{
  "schema_version": "2.0",
  "run_id": "observed_full_20260408_150010",
  "lane": "full",
  "started_at": "2026-04-08T15:00:10.6631694-04:00",
  "ended_at": "2026-04-08T15:01:05.0172531-04:00",
  "runtime_ms": 54354,
  "commit_hash": "5862bf696f147cbbe13fb7a301b5cae4927236f5",
  "runner": "local",
  "pass_count": 1,
  "fail_count": 0,
  "flaky_count": 0,
  "failure_mode": "deterministic",
  "promotion_gate": {
    "lane_green": true,
    "merge_recommended": true,
    "deploy_recommended": true,
    "reason": "Full deck passed."
  },
  "artifact_completeness": {
    "worker_stdout": true,
    "worker_stderr": true,
    "db_snapshot": false,
    "timing_trace": false
  },
  "proven_property_status": null,
  "open_risks": null,
  "test_index": {
    "results": [
      {
        "test_id": "full_ledger_deck",
        "status": "PASS",
        "result_path": "results/full_ledger_deck.json"
      }
    ]
  }
}
