{
  "schema_version": "2.0",
  "run_id": "run_01_race_single_pass_success",
  "lane": "race",
  "started_at": "2026-04-08T12:00:00Z",
  "ended_at": "2026-04-08T12:00:12Z",
  "runtime_ms": 12000,
  "commit_hash": null,
  "runner": "local",
  "pass_count": 2,
  "fail_count": 0,
  "flaky_count": 0,
  "failure_mode": "deterministic",
  "promotion_gate": {
    "lane_green": true,
    "merge_recommended": true,
    "deploy_recommended": false,
    "reason": "Race lane passed once; soak lane not run."
  },
  "artifact_completeness": {
    "worker_stdout": true,
    "worker_stderr": true,
    "db_snapshot": true,
    "timing_trace": true
  },
  "proven_property_status": {
    "single_winner_credit_allocation": "proven",
    "refund_cap_under_contention": "proven"
  },
  "open_risks": [
    "No soak evidence yet; determinism under repeated contention not proven."
  ],
  "test_index": {
    "results": [
      {
        "test_id": "race_credit_single_winner",
        "status": "PASS",
        "result_path": "results/race_credit_single_winner.json"
      },
      {
        "test_id": "race_refund_cap_under_contention",
        "status": "PASS",
        "result_path": "results/race_refund_cap_under_contention.json"
      }
    ]
  }
}

